Trial Number,Sentence Duration,Time To Response Start,Time to Response End,Talker,Active Channels,Subject Responses / Target Sentences,Words Correct,Total Words
1,2.3729,3.9148,9.3757,TA,02_10_11_14_16_17_18_,his wings are shaped like a ...,,7
,,,,,,brass rings are sold by these natives,,
2,2.2382,2.6883,13.2955,AW,01_05_09_12_16_19_20_,wipe the grease off his dirty face ,,7
,,,,,,wipe the grease off his dirty face,,
3,2.5615,3.8884,9.5652,TA,01_05_07_08_09_17_20_,his ... was less than others ,,7
,,,,,,these pills do less good than others,,
4,2.2755,4.5208,8.1365,AW,07_08_09_14_15_18_19_,the right fence ,,7
,,,,,,the bog crawled under the high fence,,
5,2.6119,3.6984,15.0576,AW,06_07_08_11_14_15_16_,the jacket from the different chair ,,10
,,,,,,the jacket hung on the back of the wide chair,,
6,2.4047,3.0815,9.2586,AW,02_10_14_16_17_18_20_,the smell crept towards the end ,,7
,,,,,,a small creek cut across the field,,
7,2.6818,3.5595,15.5907,TA,01_06_09_11_12_14_16_,the clouds get grey on rainy days ,,7
,,,,,,tight curls get limp on rainy days,,
8,2.5216,2.2315,9.0712,TA,02_04_07_08_09_13_16_,watch the log float in the wide river ,,8
,,,,,,watch the log float in the wide river,,
9,2.3435,1.3101,12.0163,TA,03_08_11_14_18_19_20_,it seems to crack the skull of defense ,,7
,,,,,,a siege will crack the strong defense,,
10,2.1005,5.4018,15.3769,TA,01_04_05_09_17_18_20_,says the seen .. and hide the bag ,,8
,,,,,,jump the fence and hurry up the bank,,
11,2.4283,2.886,9.0692,TA,03_05_07_09_13_17_19_,the red tape hides the smuggled food ,,7
,,,,,,the red tape bound the smuggled food,,
12,2.2774,2.7088,13.7789,AW,01_07_09_11_17_18_20_,there was a sound to someone outside,,8
,,,,,,there was a sound of dry leaves outside,,
13,2.2346,3.2208,9.5881,AW,01_03_06_09_10_14_19_,the bright continues to rest ,,7
,,,,,,the pipe began to rust while new,,
14,2.3385,4.6309,8.9294,TA,05_08_10_12_15_16_20_,cut the cloth to make a book ,,7
,,,,,,pages bound in cloth make a book,,
15,2.8842,3.2861,16.7668,AW,01_05_10_11_13_15_16_,the right peice of cheese improves with age,,8
,,,,,,the ripe taste of cheese improves with age,,
16,2.3858,3.886,11.1094,AW,01_02_07_11_14_16_19_,his friends deserve jail ,,6
,,,,,,thieves who rob friends deserve jail,,
17,2.4537,3.0672,11.5146,AW,01_02_05_06_12_16_20_,the friends on the train .. his elbow shaped ,,9
,,,,,,the fruit of a fig tree is apple-shaped,,
18,2.2175,2.6519,11.1333,TA,01_02_06_15_16_18_20_,legend the story makes good sense ,,7
,,,,,,much of the story makes good sense,,
19,2.6918,4.176,13.8633,AW,04_05_07_10_12_13_20_,below the seed to the dark background ,,8
,,,,,,glue the sheet to the dark blue background,,
20,2.8559,3.6403,10.6158,TA,01_02_07_09_11_16_17_,you can relax in the clean green grass ,,8
,,,,,,bathe and relax in the cool green grass,,
21,2.3374,2.7765,7.7942,AW,01_02_06_09_15_16_17_,torn scrubs means ,,6
,,,,,,torn scraps littered the stone floor,,
22,2.5308,2.7946,15.3245,TA,01_05_07_10_15_16_17_,the ... occurred by the bank on main street ,,9
,,,,,,the wreck occurred by the bank on main street,,
23,2.5616,3.2606,11.54,TA,04_06_07_09_15_16_17_,he took the axe to the side of the flourist ,,10
,,,,,,they took the axe and the saw to the forest,,
24,2.3483,2.6193,9.6935,TA,06_10_12_13_15_18_19_,the rest of the news is easy for us to hear ,,10
,,,,,,most of the news is easy for us to hear,,
25,2.4303,2.498,9.8202,TA,05_07_08_09_12_16_20_,great things streched for miles around ,,6
,,,,,,gray paint stretched for miles around,,
26,2.2242,2.6549,10.3321,AW,01_03_06_11_15_17_18_,it's easy to tell the depth of a well ,,9
,,,,,,it's easy to tell the depth of a well,,
27,2.6949,2.7721,11.5742,TA,02_03_04_08_10_13_20_,the foot of the raft is coming right back ,,10
,,,,,,they floated on the raft to sun their white backs,,
28,2.5802,4.2578,7.0016,TA,01_05_06_07_14_15_19_,to get the means ,,8
,,,,,,nine men were hired to dig the ruins,,
29,2.5859,3.2401,11.6393,TA,04_06_07_12_17_18_19_,the side of dust and his tender eyes ,,8
,,,,,,a cloud of dust stung his tender eyes,,
30,1.7675,2.8161,8.1278,AW,04_05_07_12_13_16_18_,what joy is there in living ,,6
,,,,,,what joy there is in living,,
31,2.3381,3.1472,12.2489,TA,09_12_13_16_18_19_20_,the whole house was on fire to the attic ,,9
,,,,,,the brown house was on fire to the attic,,
32,2.5116,3.0024,13.1224,TA,02_04_06_08_11_14_17_,the luirs used to catch trout and flounder ,,9
,,,,,,the lure is used to catch trout and flounder,,
33,2.2186,2.7677,11.2228,AW,02_04_07_09_10_11_17_,the young trout suffered from his height ,,7
,,,,,,a young child should not suffer fright,,
34,2.2172,3.3078,9.6431,TA,03_04_05_07_10_13_17_,the person sat down and listened ,,7
,,,,,,the birch looked stark white and lonesome,,
35,2.1789,2.325,8.6793,TA,01_04_07_09_11_12_18_,clean the sheep while the dog wanders ,,7
,,,,,,tend the sheep while the dog wanders,,
36,2.2054,2.4481,7.2183,AW,02_06_07_10_13_14_18_,always close the barn door tight ,,6
,,,,,,always close the barn door tight,,
37,2.9307,3.4058,9.9178,TA,03_05_08_09_10_11_14_,learn to go to the wall and spill it there ,,10
,,,,,,carry the pail to the wall and spill it there,,
38,2.5498,4.6329,12.5762,TA,01_06_09_11_15_16_18_,report to the council about a thief ,,9
,,,,,,plead to the council to free the poor thief,,
39,2.5225,4.7971,12.1245,TA,01_05_08_11_12_16_17_,he's the line over the porch side ,,7
,,,,,,heave the line over the port side,,
40,2.2986,2.919,12.9261,TA,04_05_07_09_13_15_17_,we need green to keep on the old selfie ,,8
,,,,,,we need grain to keep our mules healthy,,
41,2.0734,3.0909,7.2104,AW,01_02_03_12_13_17_19_,educates ,,6
,,,,,,cut the pie into large parts,,
42,2.318,2.8662,10.0656,TA,01_02_03_04_09_13_17_,he crawled with care along the ledge ,,7
,,,,,,he crawled with care along the ledge,,
43,3.1265,3.6428,13.3147,AW,06_07_08_13_14_16_20_,what you do when you offer to leave ,,10
,,,,,,those words were the cue for the actor to leave,,
44,2.3052,3.5074,11.7682,AW,03_05_06_12_14_15_16_,handle the orders with great speed ,,7
,,,,,,act on these orders with great speed,,
45,3.0687,3.7301,13.3933,TA,01_03_08_10_12_15_18_,the ... costs five cents on mondays ,,7
,,,,,,a cone costs five cents on mondays,,
46,2.059,2.4952,8.1508,TA,03_06_08_14_18_19_20_,the flag hangs way on your wall ,,8
,,,,,,the fly made its way along the wall,,
47,2.7527,3.6225,5.2787,AW,02_03_06_07_15_16_18_,great day ,,9
,,,,,,the sky that morning was clear and bright blue,,
48,2.7024,2.7728,14.3424,TA,01_05_08_09_11_14_18_,the doorknob was made of bright grey brass ,,8
,,,,,,the doorknob was made of bright clean brass,,
49,2.1351,3.3289,8.5926,AW,04_07_10_14_17_18_20_,the funds are right ,,7
,,,,,,fairy tales should be fun to write,,
50,2.2322,4.2916,9.3872,TA,01_02_04_06_07_13_20_,blowing in the breeze ,,6
,,,,,,pink clouds floated with the breeze,,
51,2.854,2.2656,12.1077,AW,04_05_07_09_11_16_19_,leaves turn brown and then yellow in the fall ,,8
,,,,,,leaves turn brown and yellow in the fall,,
52,2.5163,4.7839,6.8075,AW,01_05_08_09_13_14_19_,dust cup ,,8
,,,,,,the cigar burned a hole in the desktop,,
53,2.4813,2.9897,12.261,TA,03_04_06_10_12_15_19_,check the strip of wood to the floor ,,9
,,,,,,tack the strip of carpet to the worn floor,,
54,2.718,4.7879,11.4273,TA,03_04_05_10_11_12_20_,the high tunes of the fork ,,9
,,,,,,the mute muffled the high tones of the horn,,
55,2.6919,3.9199,9.3114,AW,02_06_08_09_13_19_20_,the ... suffering ,,9
,,,,,,the pearl was worn in a thin silver ring,,
56,2.1517,2.3326,11.1804,AW,04_06_07_11_13_14_20_,the lawyer tried to lose his case ,,7
,,,,,,the lawyer tried to lose his case,,
57,2.4643,3.921,11.0404,TA,03_07_10_12_16_19_20_,nine soldiers get in line ,,7
,,,,,,nine rows of soldiers stood in line,,
58,2.6365,4.1363,10.7358,AW,03_05_06_08_10_12_17_,threw the bone over the fence ,,7
,,,,,,lift the square stone over the fence,,
59,2.165,2.974,8.0936,AW,04_07_09_12_14_19_20_,a cup of sweet fudge ,,7
,,,,,,a cup of sugar makes sweet fudge,,
60,2.9253,4.9669,9.4064,AW,03_04_07_13_14_18_19_,is the clear spring ,,10
,,,,,,the source of the huge river is the clear spring,,
61,2.4141,3.1057,7.8093,AW,02_07_10_11_12_18_20_,the office pool was a .. ,,8
,,,,,,the office paint was a dull sad tan,,
62,1.7751,2.1975,9.336,AW,01_04_05_09_12_13_19_,the pencils are moving instinct ,,6
,,,,,,the pencils have all been used,,
63,2.2428,3.1252,8.2927,TA,01_09_10_13_15_17_19_,mix juice and water well ,,6
,,,,,,grape juice and water mix well,,
64,2.5067,2.3719,10.4382,TA,01_06_09_12_14_16_19_,the large house had hot water tabs ,,7
,,,,,,the large house had hot water taps,,
65,2.9691,3.4241,11.6174,TA,04_08_09_10_11_14_19_,the shower full of jam .. both crackers ,,9
,,,,,,the shelves were bare of both jam or crackers,,
66,1.9898,3.2535,8.1491,TA,02_07_08_10_14_17_20_,twice the ... getting away ,,8
,,,,,,just hoist it up and take it away,,
67,2.592,3.6233,11.1269,TA,02_03_07_09_13_18_20_,the house built of sand doing four ,,8
,,,,,,a castle built from sand fails to endure,,
68,2.6917,3.9183,12.4855,AW,01_09_10_13_14_15_16_,i haven't heard from ron in a month ,,8
,,,,,,the slang word for raw whiskey is booze,,
69,2.2992,3.4871,8.8947,AW,01_03_08_09_11_12_20_,the case of weapons makes mine ..,,7
,,,,,,the juice of lemons makes fine punch,,
70,2.2158,3.5258,9.9093,TA,03_04_06_08_15_16_17_,the glass filled the empty room ,,7
,,,,,,the rude laugh filled the empty room,,
71,2.8288,3.9713,12.0426,TA,01_02_03_07_08_11_15_,your .. was tricky case to crack ,,8
,,,,,,yell and clap as the curtain slides back,,
72,1.9971,2.0343,8.7084,TA,01_07_09_11_12_16_17_,time brings us many changes ,,5
,,,,,,time brings us many changes,,
73,2.684,3.4477,16.4548,AW,04_09_11_13_17_18_19_,the strip was next to the side peice ,,9
,,,,,,the ship was torn apart on the sharp reef,,
74,2.0862,3.1963,14.0115,TA,02_03_05_08_11_13_15_,his bright was made for walking on ,,7
,,,,,,this plank was made for walking on,,
75,2.5212,2.6641,12.2821,TA,02_03_04_06_11_15_19_,the desk was firm on the shaky floor ,,8
,,,,,,the desk was firm on the shaky floor,,
76,2.6669,3.1266,11.0314,AW,03_04_06_07_10_15_18_,the swadler was four shades of perfect ,,8
,,,,,,the swan dive was far short of perfect,,
77,2.6619,1.8234,7.9139,AW,01_03_05_11_13_18_19_,don't move the oiled .. ,,7
,,,,,,the wagon moved on well oiled wheels,,
78,2.4594,3.1535,10.001,TA,04_06_12_13_14_18_20_,the kind with black light looks best ,,7
,,,,,,a pencil with black lead writes best,,
79,2.2717,2.8056,9.6934,TA,04_07_10_13_15_18_19_,some served to treat meyers ,,6
,,,,,,some ads serve to cheat buyers,,
80,2.465,3.8017,11.2994,AW,01_02_05_09_15_17_19_,strive to southern sandwich ,,6
,,,,,,men strive but seldom get rich,,
