Trial Number,Sentence Duration,Time To Response Start,Time to Response End,Talker,Active Channels,Subject Responses / Target Sentences,Words Correct,Total Words
1,2.8234,4.3771,13.4087,TA,02_03_04_10_14_16_18_,PAPER is sCARE so WRITE with MUCH CARE,,5
,,,,,,PAPER SCARCE WRITE MUCH CARE,,
2,2.7651,1.5589,8.1597,AW,02_04_06_08_11_15_17_,the HEART BEATs strong STROKES,,5
,,,,,,HEART BEAT STRONGLY FIRM STROKES,,
3,2.0399,4.1293,6.2089,AW,02_05_07_08_12_14_18_,SPILLED WATER,,5
,,,,,,RAG SOAK UP SPILLED WATER,,
4,2.3925,4.658,6.6336,TA,01_05_06_07_12_14_17_,in the WOOD,,5
,,,,,,LATHE CUTS TRIMS ANY WOOD,,
5,2.5358,4.4492,7.5291,AW,02_03_10_11_13_14_17_,it is to CATCH ,,5
,,,,,,ROD USED CATCH PINK SALMON,,
6,2.4882,4.079,8.7347,AW,01_04_10_16_17_18_20_,in the SIMPLEST THINGS,,5
,,,,,,WE FIND JOY SIMPLEST THINGS,,
7,2.4031,4.1773,6.225,TA,02_07_08_09_15_18_19_,clock eyes,,5
,,,,,,CUT CORD BINDS BOX TIGHTLY,,
8,2.4906,4.1682,11.4879,AW,04_06_07_13_14_17_20_,is TOO HIGH for the COUCH,,5
,,,,,,COFFEE STAND TOO HIGH COUCH,,
9,2.9383,4.2963,8.1761,AW,02_05_10_11_13_14_16_,mean sounding person ,,5
,,,,,,HEMP WEED FOUND PARTS TROPICS,,
10,2.6072,4.5578,7.0855,AW,02_03_06_09_12_13_14_,LEADS to WRONG,,5
,,,,,,ADDING FAST LEADS WRONG SUMS,,
11,2.351,3.6473,7.4949,AW,07_10_12_17_18_19_20_,have to REACH the LAKE,,5
,,,,,,TAKE WINDING PATH REACH LAKE,,
12,3.1203,3.5434,12.4631,TA,02_04_08_09_10_14_19_,the rocks FELL and TUMBLED into the CLEAR STREAM,,5
,,,,,,LOGS FELL TUMBLED CLEAR STREAM,,
13,2.1907,2.837,5.2609,AW,02_06_07_10_14_15_16_,he felt ,,5
,,,,,,SEWED TORN COAT QUITE NEATLY,,
14,2.8036,3.9517,7.7745,AW,01_07_11_15_16_18_19_,SIDE SHOW in the CIRCUS,,5
,,,,,,WE TALKED SIDE SHOW CIRCUS,,
15,2.6796,3.7779,7.7856,AW,03_06_08_10_11_15_18_,water KEEPS INSIDE,,5
,,,,,,MESH WIRE KEEPS CHICKS INSIDE,,
16,2.3183,4.1533,10.0247,TA,01_02_10_11_13_17_20_,the RAIN MADE a PLEASANT SOUND,,5
,,,,,,DRIP RAIN MADE PLEASANT SOUND,,
17,2.8584,3.3276,10.6312,TA,03_06_07_11_12_17_20_,SOAK the CLOTH in meter,,5
,,,,,,SOAK CLOTH DROWN SHARP ODOR,,
18,2.7317,5.3561,13.8034,TA,03_07_08_10_14_18_20_,the STORE WALLS were LINED with COLORED FROCKS,,5
,,,,,,STORE WALLS LINED COLORED FROCKS,,
19,2.5212,4.5381,6.8257,AW,03_06_08_16_18_19_20_,ALONG the STREET,,5
,,,,,,SLUSH LAY DEEP ALONG STREET,,
20,2.4292,3.2726,9.2482,AW,04_05_08_10_13_17_19_,she HAS a SMART WAY of WEARING CLOTHES,,5
,,,,,,HAS SMART WAY WEARING CLOTHES,,
21,2.0977,2.5331,9.8927,TA,02_03_06_09_12_16_19_,AFTER the DANCE they WENT STRAIGHT HOME,,5
,,,,,,AFTER DANCE WENT STRAIGHT HOME,,
22,1.8899,2.3933,6.7451,TA,04_05_08_11_14_15_17_,SMOKE POURED OUT of EVERY CRACK,,5
,,,,,,SMOKE POURED OUT EVERY CRACK,,
23,2.5424,3.7349,7.5667,AW,03_05_08_09_13_14_18_,the place SEEMS DULL and ,,5
,,,,,,PLAY SEEMS DULL QUITE STUPID,,
24,3.1451,4.9365,7.9521,TA,02_07_09_11_17_18_19_,with a HOT CROSS BUN,,5
,,,,,,ZESTFUL FOOD HOT CROSS BUN,,
25,2.1472,3.815,9.8786,TA,03_06_11_12_16_18_19_,the FIRST one was SNAPPED EARLY,,5
,,,,,,FIRST WORM GETS SNAPPED EARLY,,
26,2.5355,3.6204,8.564,AW,01_02_09_10_16_17_19_,the jumps the RUSTY GATEs,,5
,,,,,,YOUNG KID JUMPED RUSTY GATE,,
27,2.8078,5.1646,7.8762,TA,02_08_15_16_17_18_19_,was in the LAST class,,5
,,,,,,LET JOIN SING LAST CHORUS,,
28,2.7127,5.2471,8.3898,AW,03_04_05_08_13_16_20_,to the little MOUSE,,5
,,,,,,CROOKED MAZE FAILED FOOL MOUSE,,
29,2.5034,9.4725,13.1054,TA,01_04_05_14_15_16_20_,the movie ,,5
,,,,,,THAW CAME EARLY FREED STREAM,,
30,2.8163,4.5927,9.2083,TA,03_05_09_11_13_14_19_,in the CENTRAL PART of TOWN,,5
,,,,,,ZONES MERGE CENTRAL PART TOWN,,
31,3.0359,3.6774,15.5649,AW,01_06_09_10_12_14_16_,the BARK of the PINE TREEs was SHINY and DARK,,5
,,,,,,BARK PINE TREE SHINY DARK,,
32,2.8837,4.6931,8.8926,TA,02_03_04_09_16_17_18_,the first FIELD case,,5
,,,,,,HORSE TROTTED FIELD BRISK PACE,,
33,2.8982,3.7984,6.4941,TA,03_06_07_09_18_19_20_,the surface calm,,5
,,,,,,SHIRT CLEAN ONE BUTTON GONE,,
34,2.1722,3.298,13.1055,TA,02_05_06_08_11_15_16_,put the on TOP of the BATH WATER,,5
,,,,,,FLOAT SOAP TOP BATH WATER,,
35,2.24,3.7606,6.5844,TA,04_05_09_11_14_15_17_,he WROTE his LAST ,,5
,,,,,,WROTE LAST NOVEL AT INN,,
36,2.4276,3.8206,9.1002,TA,02_05_06_08_11_12_18_,why SMALL face mints,,5
,,,,,,WHITINGS SMALL FISH CAUGHT NETS,,
37,2.5842,2.9214,9.7447,AW,03_04_05_06_09_14_18_,the SEIZED the CREW of the last SHIP,,5
,,,,,,PIRATES SEIZED CREW LOST SHIP,,
38,2.6006,4.4679,12.9074,TA,01_05_06_09_10_15_18_,his head STRUCK the KNEE of the NEXT PLAYER,,5
,,,,,,HIP STRUCK KNEE NEXT PLAYER,,
39,2.3272,3.4571,9.0247,TA,01_02_03_06_14_18_20_,it would be cool to FIND the campsite,,5
,,,,,,LOOK CORNER FIND TAN SHIRT,,
40,2.8837,3.4881,11.7028,TA,01_05_06_11_13_14_20_,the fence behind march,,5
,,,,,,FLINT SPUTTERED LIT PINE TORCH,,
41,2.6632,3.1352,11.9587,AW,02_03_09_11_12_13_16_,he CARVED his HEAD from the ROUND BLOCK of wood,,5
,,,,,,CARVED HEAD ROUND BLOCK MARBLE,,
42,2.6448,3.4592,6.7228,TA,01_03_04_05_06_13_18_,the boss spoiled ,,5
,,,,,,DASH PEPPER SPOILS BEEF STEW,,
43,2.8738,5.1541,9.3697,AW,02_04_06_09_12_16_20_,STALLED in SNOW DRIFTS,,5
,,,,,,CARS BUSSES STALLED SNOW DRIFTS,,
44,2.442,4.2041,8.6998,TA,01_08_12_13_14_15_19_,is FIT for a KING's power,,5
,,,,,,RIPE PLUM FIT KING PALATE,,
45,2.4852,4.9388,23.8021,AW,01_02_04_05_06_08_20_,MAKES the most moat,,5
,,,,,,TAME SQUIRREL MAKES NICE PET,,
46,2.1722,4.2253,7.6408,TA,01_04_05_09_11_15_18_,talking to SERVE,,5
,,,,,,HOSTESS TAUGHT NEW MAID SERVE,,
47,2.7791,3.6905,11.282,AW,02_04_11_12_15_18_19_,the SET of CHINA HIT the FLOOR with a CRASH,,5
,,,,,,SET CHINA HIT FLOOR CRASH,,
48,2.8062,2.7889,11.2376,TA,01_04_07_09_11_13_17_,he BROKE his TIES with GROUPS of FORMER FRIENDS,,5
,,,,,,BROKE TIES GROUPS FORMER FRIENDS,,
49,2.4075,4.1639,8.0836,AW,02_04_08_09_16_17_19_,top of the grass weaves,,5
,,,,,,PICK BRIGHT ROSE WITHOUT LEAVES,,
50,2.4312,2.8004,7.9442,AW,02_04_06_07_11_15_18_,the BOY was barely seven years,,5
,,,,,,BOY THERE WHEN SUN ROSE,,
51,2.7009,3.2999,5.6677,AW,04_05_08_09_11_14_15_,FLAME seats,,5
,,,,,,SMOKEY FIRES LACK FLAME HEAT,,
52,2.421,3.8595,5.7395,TA,06_07_08_13_16_17_19_,SUCH a ,,5
,,,,,,FRESH START WORK SUCH WONDERS,,
53,2.4108,4.8271,6.8508,TA,02_05_13_14_15_17_19_,printed read,,5
,,,,,,MARK SPOT SIGN PAINTED RED,,
54,2.8327,3.4086,9.9202,TA,05_06_08_13_14_16_17_,he smoked a BIG PIPE with STRONG CONTENTS,,5
,,,,,,SMOKES BIG PIPE STRONG CONTENTS,,
55,2.5253,2.947,10.4347,AW,02_05_07_11_16_17_19_,the HARDER he TRIED the LESS he GOT DONE,,5
,,,,,,HARDER TRIED LESS GOT DONE,,
56,2.6649,3.6985,8.2583,AW,01_04_09_11_12_16_17_,you of the week times,,5
,,,,,,FEEL HEAT WEAK DYING FLAME,,
57,2.4896,4.259,12.8105,AW,02_06_10_12_14_18_20_,a rough START does NOT WIN the PRIZE,,5
,,,,,,ABRUPT START NOT WIN PRIZE,,
58,2.5707,4.2831,13.8826,TA,01_05_07_09_12_15_17_,STALK of WHEAT GREW barley,,5
,,,,,,NODE STALK WHEAT GREW DAILY,,
59,1.6299,3.244,5.9317,TA,04_06_12_16_17_18_20_,COME through LATER,,5
,,,,,,GO NOW COME HERE LATER,,
60,2.1259,3.08,11.9436,AW,03_04_08_12_13_15_16_,the WAVED WHEN the WINDs blow,,5
,,,,,,PENNANT WAVED WHEN WIND BLEW,,
61,1.918,3.2418,9.0414,TA,03_06_08_12_18_19_20_,ADD SALT BEFORE you FRY the EGG,,5
,,,,,,ADD SALT BEFORE FRY EGG,,
62,2.4276,3.4964,11.0399,TA,01_02_05_07_10_11_16_,the WAXED FLOOR MAKES us LOSE BALANCE,,5
,,,,,,WAXED FLOOR MAKES LOSE BALANCE,,
63,2.3141,4.4437,7.0993,AW,06_07_11_13_14_19_20_,move tax,,5
,,,,,,PAPER BOX FULL THUMB TACKS,,
64,2.2883,2.8911,7.9628,TA,01_03_09_14_17_18_19_,it is LATE MORNING on the,,5
,,,,,,LATE MORNING OLD WALL CLOCK,,
65,2.7301,3.6056,9.4772,AW,01_09_11_12_13_16_19_,STUNNED the YOUNG BOY,,5
,,,,,,BEAUTY VIEW STUNNED YOUNG BOY,,
66,2.4849,5.4998,10.9796,AW,01_02_05_09_11_16_19_,council to WRITE the FIRST DRAFT,,5
,,,,,,USE PENCIL WRITE FIRST DRAFT,,
67,2.3188,5.075,7.795,AW,01_07_11_12_17_18_20_,with his supporters,,5
,,,,,,TYPE OUT THREE LISTS ORDERS,,
68,1.9029,3.3917,8.9433,AW,02_09_12_14_15_18_20_,he grew up in her shoes THAT time,,5
,,,,,,BROKE NEW SHOELACE THAT DAY,,
69,3.0292,4.2279,9.2434,TA,02_05_14_16_18_19_20_,she changed a yeast in his DRINKS,,5
,,,,,,FRUIT FLAVORS USED FIZZ DRINKS,,
70,2.5653,4.9155,8.5392,AW,03_04_07_09_12_15_16_,was FULL with TRASH,,5
,,,,,,HER PURSE FULL USELESS TRASH,,
71,2.4818,4.795,6.7146,AW,06_08_12_13_17_18_19_,on a GOOD day,,5
,,,,,,SELL GIFT BUYER GOOD GAIN,,
72,2.3043,2.7695,9.9852,TA,03_05_11_12_16_18_19_,BEEF is SCARCER THAN LAMB,,5
,,,,,,BEEF SCARCER THAN SOME LAMB,,
73,2.1034,4.1237,5.2913,AW,06_07_08_13_14_19_20_,the OTHER,,5
,,,,,,CATS DOGS EACH HATE OTHER,,
74,2.6209,4.5291,7.4888,TA,03_05_08_09_12_13_20_,home in the CLOSET,,5
,,,,,,DARK POT HUNG FRONT CLOSET,,
75,2.7396,2.6977,10.0905,TA,01_03_08_12_16_17_20_,the HOUSES are BUILT of RED CLAY BRICKS,,5
,,,,,,HOUSES BUILT RED CLAY BRICKS,,
76,2.3986,3.7651,19.0044,AW,03_05_09_11_13_15_18_,the kitchen was RED plate,,5
,,,,,,SOFA CUSHION RED LIGHT WEIGHT,,
77,2.2058,4.4699,7.5657,TA,03_04_11_12_14_15_20_,war skip ,,5
,,,,,,BOARDS WARP UNLESS KEPT DRY,,
78,2.5503,6.5905,8.95,AW,01_04_05_08_10_11_17_,trimming grass,,5
,,,,,,PASTE CLEANSE MOST DIRTY BRASS,,
79,2.5709,5.2218,10.3735,TA,01_02_09_12_14_15_20_,is NEEDED,,5
,,,,,,SCREW ROUND CAP TIGHT NEEDED,,
80,2.4188,5.0052,12.6378,AW,01_04_05_09_15_18_19_,clear the BOAT to STOP it FROM SINKING,,5
,,,,,,BAIL BOAT STOP FROM SINKING,,
