Trial Number,Sentence Duration,Time To Response Start,Time to Response End,Talker,Active Channels,Subject Responses / Target Sentences,Words Correct,Total Words
1,2.1683,79.4245,108.335,AW,18_14_09_08_07_05_03_,he wear his woof huffs for the COLD,,5
,,,,,,MARSH FREEZE WHEN COLD ENOUGH,,
2,2.307,9.9013,39.4211,TA,20_18_13_09_08_07_03_,the sat on the whole grapes tere weer big,,5
,,,,,,COUCH COVER HALL DRAPES BLUE,,
3,2.4182,7.8335,36.7449,AW,19_15_13_12_09_07_03_,safe until it s CLEAR,,5
,,,,,,SAY SLOWLY MAKE RING CLEAR,,
4,2.6633,5.9249,64.2997,TA,20_18_13_09_07_06_04_,he screamed BEFORE the flower pickng..ops,,5
,,,,,,SCREEN BEFORE FIRE KEPT SPARKS,,
5,2.2226,6.935,100.5335,TA,21_18_13_12_05_04_03_,the MAN wear a FELT fether in his hst,,5
,,,,,,MAN WORE FEATHER FELT HAT,,
6,2.6151,5.2826,62.3215,AW,19_18_15_13_10_06_04_,swing the post....,,5
,,,,,,SCREEN PORCH WOVEN STRAW MATS,,
7,2.6092,5.6857,40.9012,TA,20_11_10_08_07_06_05_,im sorry i dont know,,5
,,,,,,DISPENSE VEST DAY LIKE THIS,,
8,2.5509,13.1892,60.6444,AW,21_19_13_11_08_07_06_,sorry  dont know,,5
,,,,,,CHAP SKIPPED INTO CROWD LOST,,
9,2.2786,12.565,32.2283,TA,22_18_15_14_12_09_05_,her hat is blowing in the wind,,5
,,,,,,HAVE BETTER THAN WAIT HOPE,,
10,2.3172,11.6428,62.8102,AW,21_18_16_15_11_09_05_,you have to KEEP your head in order to succeed,,5
,,,,,,NO HARDSHIP KEEP HIM SAD,,
11,2.1497,7.034,48.7288,TA,21_20_19_15_13_10_03_,when you do the old ALL sees to MATTER,,5
,,,,,,NEED END ALL SUCH MATTER,,
12,2.3986,10.0635,51.9349,TA,21_17_12_10_09_07_03_,the wolve ran right with the elephsne,,5
,,,,,,WALL PHONE RANG LOUD OFTEN,,
13,2.3841,5.7232,78.6889,TA,19_16_13_10_08_05_04_,we DONt GET much MONEY but still HAVE ,,5
,,,,,,DON GET MONEY HAVE FUN,,
14,2.2163,7.1949,60.7457,AW,22_19_15_10_08_06_05_,he PICKED UP the giy in three SECOND weight,,5
,,,,,,PICKED UP DICE SECOND ROLL,,
15,2.4705,9.7701,81.113,TA,22_19_15_14_13_10_07_,you quality is grest snd you seen to have n,,5
,,,,,,CLOTHES DRIED THIN WOODEN RACK,,
16,2.4497,15.8283,63.8513,AW,21_16_13_12_11_05_03_,to the fct of that ,,5
,,,,,,THREE DIME YOUNG PEDDLER CRIED,,
17,1.9331,7.4533,48.5325,AW,22_21_20_15_09_05_04_,dont kow,,5
,,,,,,NUDGE GENTLY WAKE HER NOW,,
18,2.3587,8.6224,134.348,AW,21_19_16_14_13_12_06_,how can  u know its TEA and it is time for diner? ,,5
,,,,,,HATS WORN TEA NOT DINNER,,
19,2.1384,5.7369,140.7903,AW,17_15_11_10_06_05_04_,I have  next PULLED the inviove to know what neds to pull,,5
,,,,,,NAG PULLED FRAIL CART ALONG,,
20,2.3819,8.2435,181.4163,AW,21_20_17_16_08_07_05_,the change to the WALL was quick inprovement,,5
,,,,,,CHINK WALL ALLOWED DRAFT BLOW,,
21,2.0618,4.6045,103.6906,AW,17_16_15_12_09_08_07_,I have ALWAYS delt with you and it work out greatly,,5
,,,,,,POD PEAS ALWAYS GROW IN,,
22,2.6255,5.0944,54.3813,TA,21_20_17_14_11_07_04_,he riged the BIKE to climb the winning rosd,,5
,,,,,,WHEELED BIKE PAST WINDING ROAD,,
23,2.0331,9.9888,71.2357,AW,22_21_20_18_16_07_04_,the wheell.....,,5
,,,,,,RAMP LED UP WIDE HIGHWAY,,
24,2.8732,9.395,55.874,AW,22_21_18_15_11_09_04_,they said they would serve us drinks aster the xmas dinner,,5
,,,,,,SAND DRIFTS OVER SILL HOUSE,,
25,2.0928,7.0809,66.9597,AW,20_19_18_13_12_08_04_,twill the swester snd watch the ....,,5
,,,,,,TWIST VALVE RELEASE HOT STEAM,,
26,2.2165,5.7974,40.4529,AW,18_17_16_15_07_06_05_,im sory i dont know whst dhe said,,5
,,,,,,BOY OWED PAL THIRTY CENTS,,
27,2.4938,9.1581,41.6454,TA,19_17_16_14_08_07_06_,i dont know,,5
,,,,,,HINGE DOOR CREAKED OLD AGE,,
28,2.7166,12.1323,80.0749,TA,22_21_18_16_13_12_07_,something sbout s  a heavy belt,,5
,,,,,,FIVE YEARS LIVED SHAGGY DOG,,
29,2.6411,16.9584,86.7971,AW,22_16_13_11_10_08_07_,the smile helped lot,,5
,,,,,,SENSE SMELL BETTER THAN TOUCH,,
30,2.5735,8.8211,36.9165,AW,18_17_15_14_08_07_04_,STRUCK bowl of spuds,,5
,,,,,,NEWS STRUCK DOUBT RESTLESS MINDS,,
31,2.7766,7.8609,108.0989,TA,21_18_17_15_12_11_05_,her by line on the drug  wsa well awesome reward,,5
,,,,,,BRIGHT LANTERNS GAY DARK LAWN,,
32,2.0294,7.0156,76.9341,AW,22_19_13_11_10_06_03_,gasce MAKESs UP for that great personelity,,5
,,,,,,GRACE MAKES UP LACK BEAUTY,,
33,2.2401,6.1989,113.3091,TA,21_18_17_15_12_08_07_,the grey dog ruffed to give a boost to your persanality,,5
,,,,,,GRAY MARE WALKED BEFORE COLT,,
34,2.8357,12.9857,80.7123,TA,21_19_15_13_08_04_03_,he pulled careffuly and put the deck to a stop,,5
,,,,,,BILLS MAILED PROMPTLY TENTH MONTH,,
35,2.0226,6.0979,26.0894,AW,20_17_11_10_09_04_03_,he had a few beefs from sipping,,5
,,,,,,NOW HAVE NEW BASE SHIPPING,,
36,2.179,6.5496,24.2131,TA,20_16_10_09_06_05_04_,sorry i dont know,,5
,,,,,,BIRTH DEATH MARK LIMITS LIFE,,
37,2.3174,9.0021,14.2338,AW,22_19_14_13_12_11_07_,sorry i dont know,,5
,,,,,,TAKES OATH OFFICE EACH MARCH,,
38,2.3694,7.3426,39.8059,AW,19_16_13_09_06_05_03_,to help you start itck the white box,,5
,,,,,,DRAW CHART HEAVY BLACK LINES,,
39,2.582,7.0158,33.4312,AW,17_16_12_10_09_04_03_,his credit score will be ... to his DEBT,,5
,,,,,,THESE COINS NEEDED PAY DEBT,,
40,2.42,6.1704,45.2735,AW,21_16_14_13_11_09_03_,it was a long day but the store helped wth itd sest,,5
,,,,,,COLD DIP RESTORES HEALTH ZEST,,
41,2.5898,6.7831,41.2388,AW,21_20_18_13_10_09_04_,THERE is lead on the floor where you ACT,,5
,,,,,,THERE LAG BETWEEN THOUGHT ACT,,
42,2.5545,14.027,33.6344,TA,21_18_14_13_12_08_04_,her good food was......,,5
,,,,,,KITE FLEW WILDLY HIGH WIND,,
43,2.179,9.5556,97.5061,TA,19_17_11_10_09_05_03_,the MUSIC PLAYED bad to the wsy it looked,,5
,,,,,,MUSIC PLAYED ON WHILE TALKED,,
44,2.5774,8.3851,29.5046,TA,22_19_18_14_12_08_05_,healthly ASHES was a worldy dRUG,,5
,,,,,,DROP ASHES WORN OLD RUG,,
45,2.5423,9.4233,48.0142,TA,19_16_13_12_08_07_03_,she said the sixth but KEPT the right chairs,,5
,,,,,,SENT FIGS KEPT RIPE CHERRIES,,
46,2.0822,9.979,48.9062,TA,22_19_16_14_13_09_03_,hey those wear GLASSES can READ great,,5
,,,,,,THICK GLASSES HELPED READ PRINT,,
47,2.5943,8.2818,62.9127,AW,21_17_13_11_09_05_03_,the LIST of beans was wraped clear AROUND the bass of the tire,,5
,,,,,,LIST NAMES CARVED AROUND BASE,,
48,1.9772,8.5401,97.2265,AW,21_20_15_13_10_09_07_,you have been dropped court charges and had to wait and go ,,5
,,,,,,JERK DART FROM CORK TARGET,,
49,2.0023,4.5743,27.1417,AW,22_17_15_12_11_09_06_,something about HARD WOOD,,5
,,,,,,NO CEMENT HOLD HARD WOOD,,
50,2.8905,10.2925,58.8277,TA,19_18_14_12_09_08_06_,the guests who had BOTH CHAIRS  will meet again for a date,,5
,,,,,,DESK BOTH CHAIRS PAINTED TAN,,
51,1.9922,7.2264,39.8257,AW,21_18_14_13_09_06_03_,the shape will..,,5
,,,,,,SHEEP LED HOME BY DOG,,
52,2.211,6.8041,27.3717,AW,21_20_14_12_11_10_07_,the sraw was picked by ROBINS,,5
,,,,,,STRAW NEST HOUSED FIVE ROBINS,,
53,2.0956,6.2975,23.465,TA,17_16_15_10_07_06_04_,sorry dont know,,5
,,,,,,BOTTLES HOLD FOUR KINDS RUM,,
54,2.3678,5.6931,60.8519,AW,20_19_16_13_11_07_06_,the band with the GOLD rebal is ready to fight.,,5
,,,,,,VAMP SHOE HAD GOLD BUCKLE,,
55,2.6943,5.9299,37.7452,TA,17_14_13_08_07_04_03_,sorry all i have is a CUP and PLATE,,5
,,,,,,THROW USED PAPER CUP PLATE,,
56,2.3092,11.5374,32.8891,AW,22_21_18_17_11_07_03_,????,,5
,,,,,,THIS HORSE NOSE WAY FINISH,,
57,2.6344,6.9878,15.3956,AW,22_18_17_12_11_08_07_,sorry dont know,,5
,,,,,,DRY WAX PROTECTS DEEP SCRATCH,,
58,2.0961,0,33.6732,AW,22_21_17_14_08_07_06_,,,5
,,,,,,FASTEN TWO PINS EACH SIDE,,
59,1.8953,5.4431,81.7855,AW,22_16_14_12_06_05_03_,ONCE WE stand  near by WE start to sh,,5
,,,,,,ONCE WE STOOD BESIDE SHORE,,
61,2.2326,6.8353,19.1457,TA,22_20_18_09_08_06_03_,something about a little boy,,5
,,,,,,FENCE CUTS THROUGH CORNER LOT,,
62,2.2349,10.4031,30.8345,TA,22_20_08_06_05_04_03_,something about something MEANS,,5
,,,,,,CLEAN NECK MEANS NEAT COLLAR,,
63,2.7336,5.5468,26.4662,AW,20_16_10_09_07_04_03_,the SMELL of moms' ribs is exciting,,5
,,,,,,SMELL BURNED RAGS ITCHES NOSE,,
64,2.2135,7.028,83.2435,AW,21_16_14_12_10_07_06_,maybe the ghoust from the long will go to the morg,,5
,,,,,,BEAT DUST RUG ONTO LAWN,,
65,2.2033,4.1503,54.4452,TA,19_18_16_13_10_07_04_,the bugs were great but gave us blister,,5
,,,,,,BUNCH GRAPES PRESSED INTO WINE,,
66,2.3859,5.3802,25.3876,TA,22_16_13_12_10_08_05_,sorry i dont know,,5
,,,,,,FUR MUFF STYLISH ONCE MORE,,
67,2.3629,10.5088,33.7002,TA,18_17_13_09_07_05_03_,sorry i dont kNOw,,5
,,,,,,CHAIR LOOKED STRONG NO BOTTOM,,
68,2.5408,12.1671,133.6606,AW,22_20_17_13_12_10_05_,scooters  are forbidden to...,,5
,,,,,,SEED NEEDED PLANT SPRING CORN,,
69,2.3485,6.0462,73.5169,TA,21_18_13_11_10_08_07_,the fy by NIGHT vsn mean anyTIME,,5
,,,,,,FLY NIGHT WASTE LITTLE TIME,,
70,2.6384,0,21.3333,TA,22_18_16_13_08_07_06_,,,5
,,,,,,PRICE FAIR GOOD ANTIQUE CLOCK,,
71,2.7941,12.8364,75.6111,TA,21_19_17_15_12_09_06_,her evening lasted for a FEW DAYS,,5
,,,,,,BLOOM ROSE LASTS FEW DAYS,,
72,2.4785,8.1651,42.6442,TA,20_14_12_08_07_06_04_,the stuf ????,,5
,,,,,,CLEAT SANK DEEPLY SOFT TURF,,
73,2.8819,0,38.6317,TA,22_17_11_10_09_07_05_,,,5
,,,,,,YOUTH DROVE ZEST LITTLE SKILL,,
74,2.5989,8.1703,28.4984,TA,22_19_16_14_12_10_06_,smething about starts at 1,,5
,,,,,,TIN BOX HELD PRICELESS STONES,,
75,2.5541,6.9184,43.6855,AW,20_13_11_10_09_08_04_,her parents must ,,5
,,,,,,NEW PANTS LACK CUFFS POCKETS,,
76,2.5687,5.3916,57.2056,TA,14_11_10_07_05_04_03_,they SLICEd the sauage THIN wite KNIFE,,5
,,,,,,SLICE SAUSAGE THIN WITH KNIFE,,
77,2.2689,0,20.8218,TA,22_21_18_15_12_08_07_,,,5
,,,,,,BREAKFAST BUNS FINE HOT DRINK,,
78,2.7106,5.6679,49.059,AW,21_17_11_10_09_06_05_,plant shouldstay firm to the dto,,5
,,,,,,POINT STEEL PEN BENT TWISTED,,
79,2.1827,7.0546,54.1018,TA,22_17_14_11_09_07_04_,,,5
,,,,,,TURN LANTERN WHICH GIVES LIGHT,,
80,2.6878,4.3015,41.2848,TA,21_20_15_13_11_08_03_,dont know sorry,,5
,,,,,,CASE WAS PUZZLING OLD WISE,,
