Trial Number,Sentence Duration,Time To Response Start,Time to Response End,Talker,Active Channels,Subject Responses / Target Sentences,Words Correct,Total Words
1,2.3833,3.1847,7.5604,TA,04_05_07_10_11_16_19_,the man WALKed the MIDDLE of the ROAD ,,5
,,,,,,MEN WHO WALK MIDDLE ROAD,,
2,2.4626,3.6612,9.6211,AW,04_06_07_11_13_17_20_,the EMPTY FLASK STOOD on the TIN TRAY,,5
,,,,,,EMPTY FLASK STOOD TIN TRAY,,
3,2.4818,4.7066,8.2105,AW,03_07_13_14_16_19_20_,THIRD CLASS,,5
,,,,,,BRING BEST COMPASS THIRD CLASS,,
4,2.4944,3.8629,7.2548,TA,01_06_12_13_14_16_18_,and the BELL RINGS weekly,,5
,,,,,,JERK ROPE BELL RINGS WEAKLY,,
5,1.7373,6.0651,11.4889,TA,02_04_08_10_15_19_20_,row the ones or you MAY FORGET IT ,,5
,,,,,,WRITE ONCE MAY FORGET IT,,
6,2.2309,3.4053,7.477,AW,02_08_11_14_16_18_19_,leave your sideline for PLEASURE,,5
,,,,,,READ VERSE OUT LOUD PLEASURE,,
7,2.0152,5.2529,10.6516,AW,01_02_09_13_14_15_18_,you think girls HAVE cooties ,,5
,,,,,,PURE BRED POODLES HAVE CURLS,,
8,2.5146,4.8981,7.8977,TA,01_09_10_12_13_15_18_,made LESS than HALF of the GROUP,,5
,,,,,,WOMEN FORM LESS HALF GROUP,,
9,2.1886,3.5994,8.8391,AW,02_03_05_08_10_18_19_,the judge gave out the RIGHT VERDICT,,5
,,,,,,JUST CLAIM GOT RIGHT VERDICT,,
10,2.198,3.5958,8.9716,TA,03_04_07_10_12_14_18_,TAKE your SHARES as a FAIR PROFIT ,,5
,,,,,,TAKE TWO SHARES FAIR PROFIT,,
11,2.6526,3.6661,7.8418,TA,06_07_09_11_16_19_20_,the steel man OLD man i don't know ,,5
,,,,,,STALE SMELL OLD BEER LINGERS,,
12,2.4345,2.9956,8.4993,TA,08_10_14_15_17_19_20_,he ASKS NO PERSON to VOUCH for HIM,,5
,,,,,,ASKS NO PERSON VOUCH HIM,,
13,2.4646,6.079,10.6548,TA,01_02_03_07_10_12_14_,put the POT INTO play ,,5
,,,,,,POUR STEW POT INTO PLATE,,
14,2.3106,4.6019,5.5615,TA,04_06_08_13_15_16_18_,this is one ,,5
,,,,,,MAKE PURE ICE FREEZE WATER,,
15,2.7817,3.6798,8.4714,AW,02_06_10_15_16_18_20_,the sauce is too much it hurts ,,5
,,,,,,SAW TOOL USED MAKING BOARDS,,
16,2.3827,3.5732,8.933,AW,01_03_07_12_15_19_20_,the tapdance in a GRACEFUL WAY ,,5
,,,,,,TREE TOP WAVED GRACEFUL WAY,,
17,2.2785,3.0988,6.6746,AW,01_05_07_12_13_14_17_,the TINY GIRL TOOK OFF her HAT ,,5
,,,,,,TINY GIRL TOOK OFF HAT,,
18,2.4364,4.7628,9.1457,AW,03_06_08_09_12_17_19_,whistles will BEND in a HIGH WIND ,,5
,,,,,,THESE THISTLES BEND HIGH WIND,,
19,2.2716,4.6212,10.5249,AW,02_05_07_12_15_16_18_,wear your COAT BEFORE you GO OUT ,,5
,,,,,,MEND COAT BEFORE GO OUT,,
20,2.4984,3.1556,10.4512,AW,02_06_07_10_17_18_19_,the SALT PICKLE TASTES FINE with HAM,,5
,,,,,,SALT PICKLE TASTES FINE HAM,,
21,2.1941,2.854,13.9256,TA,02_04_07_08_10_12_14_,work FAST if you WANT to FINISH EARLY ,,5
,,,,,,WRITE FAST WANT FINISH EARLY,,
22,2.6969,4.7038,9.7115,AW,01_06_07_08_10_14_18_,combine the SEVEN BOOKS at ONCE ,,5
,,,,,,ROPE BIND SEVEN BOOKS ONCE,,
23,2.4191,2.9021,8.91,TA,03_04_05_09_11_13_20_,the SUN CAME up to LIGHT the EASTERN SKY ,,5
,,,,,,SUN CAME LIGHT EASTERN SKY,,
24,2.9637,3.9695,10.7211,TA,01_04_10_11_14_17_18_,the very fear is to awake our eyes ,,5
,,,,,,BARREL BEER BREW MALT HOPS,,
25,2.8178,3.4318,10.6707,AW,03_04_06_10_11_15_17_,the WRIST was BADLY STRAINED,,5
,,,,,,WRIST BADLY STRAINED HUNG LIMP,,
26,2.9077,4.7491,8.3969,AW,01_03_04_05_10_12_17_,sell a person to the best ,,5
,,,,,,PRESS PANTS SEW BUTTON VEST,,
27,2.781,3.7582,9.3969,AW,02_05_09_10_14_17_20_,WOOD is BEST for MAKING TOYS and BLOCKS ,,5
,,,,,,WOOD BEST MAKING TOYS BLOCKS,,
28,1.7564,3.4693,9.525,TA,01_04_08_09_10_13_16_,why SHOULD be done after,,5
,,,,,,LIVE WIRES SHOULD KEPT COVERED,,
29,2.7884,4.4819,9.2894,AW,02_03_09_11_12_15_20_,the hugs turned out to be GARBAGE,,5
,,,,,,HOGS FED CHOPPED CORN GARBAGE,,
30,2.5872,3.1109,7.7026,TA,04_07_10_11_15_16_20_,the LAMP SHONE to the pretty GREEN sham,,5
,,,,,,LAMP SHONE STEADY GREEN FLAME,,
31,2.6627,3.3283,10.3197,AW,01_02_05_08_09_15_18_,we TRIED to REPLACE the COIN BUT FAILED,,5
,,,,,,TRIED REPLACE COIN BUT FAILED,,
32,2.6332,3.1611,7.105,AW,01_03_04_10_11_16_19_,the URGE to restart this is RARE ,,5
,,,,,,URGE WRITE SHORT STORIES RARE,,
33,2.55,5.0699,8.2538,AW,04_05_06_08_09_16_20_,don't know ,,5
,,,,,,SICKNESS KEPT HOME THIRD WEEK,,
34,3.0185,4.2264,11.7459,TA,02_03_06_11_12_14_15_,put the FEET in the SNOW was the ONLY hound,,5
,,,,,,CRUNCH FEET SNOW ONLY SOUND,,
35,2.7471,5.0989,7.2668,TA,02_03_08_09_12_15_18_,to receive treatment ,,5
,,,,,,LET BURN GIVES WARMTH COMFORT,,
36,2.3686,5.1443,9.9049,AW,02_06_09_12_16_18_20_,didn't ask for the EDGE of the WATER ,,5
,,,,,,DUNE ROSE FROM EDGE WATER,,
37,2.0788,2.5892,7.2132,AW,04_08_10_11_14_16_20_,THERE the FLOODMARK is TEN INCHES ,,5
,,,,,,THERE FLOOD MARK TEN INCHES,,
38,1.5228,3.518,7.1978,TA,02_06_11_13_14_16_20_,hit THAT WITH a WOODEN STICK,,5
,,,,,,DO THAT WITH WOODEN STICK,,
39,2.3065,5.2925,9.3077,AW,05_06_07_08_16_17_18_,shouldn't put this to WASTE ,,5
,,,,,,EIGHT MILES WOODLAND BURNED WASTE,,
40,2.4945,3.5359,6.2477,TA,03_12_13_15_16_17_18_,to DRINK free beer,,5
,,,,,,COAX YOUNG CALF DRINK BUCKET,,
41,2.4593,2.9694,11.593,AW,02_04_09_10_13_15_17_,the GIRL at the grocery weighed 50 pounds ,,5
,,,,,,GIRL BOOTH SOLD FIFTY BONDS,,
42,2.7565,4.2063,9.909,AW,01_03_04_08_13_15_18_,put a POINT into the bag ,,5
,,,,,,YACHT SLID AROUND POINT BAY,,
43,2.5851,3.3585,8.5733,AW,04_05_06_09_15_16_20_,the FIN was SHARP and CUT the CLEAR WATER ,,5
,,,,,,FIN SHARP CUT CLEAR WATER,,
44,2.3468,3.339,9.6508,AW,04_09_11_12_14_15_20_,HOP OVER the FENCE and blugeon him,,5
,,,,,,HOP OVER FENCE PLUNGE IN,,
45,2.5535,3.2413,11.321,AW,01_02_04_07_09_11_15_,the CLOCK STRUCK to start the THIRD PERIOD ,,5
,,,,,,CLOCK STRUCK MARK THIRD PERIOD,,
46,2.8474,3.8086,11.7681,TA,02_06_07_11_14_16_17_,the extra pigs REACHED its point TUESDAY ,,5
,,,,,,RUSH FUNDS REACHED PEAK TUESDAY,,
47,1.9897,2.5958,7.2835,AW,03_10_12_13_14_15_19_,they can LAUGH ALTHOUGH they WERE SAD ,,5
,,,,,,COULD LAUGH ALTHOUGH WERE SAD,,
48,2.59,3.427,10.7707,TA,02_04_05_06_08_17_19_,the shore was SHALLOW at LOW TIDE ,,5
,,,,,,BEACH DRY SHALLOW LOW TIDE,,
49,2.2076,2.8175,13.577,AW,01_02_03_05_07_16_19_,all the pain and PUT the shame back??  probably not that,,5
,,,,,,ADD COLUMN PUT SUM HERE,,
50,2.9201,4.0584,10.4742,TA,02_05_06_14_15_17_19_,the blonde was laid FLAT and USELESS ,,5
,,,,,,TUBE BLOWN TIRE FLAT USELESS,,
51,2.1981,3.0385,7.4143,TA,02_06_08_13_14_17_20_,it TAKES aLOT of HELP to FINISH THESE ,,5
,,,,,,TAKES LOT HELP FINISH THESE,,
52,2.6425,3.9163,12.9559,TA,03_10_13_16_17_19_20_,you can put it away and finish the full DISTANCE ,,5
,,,,,,TOOK LEAD KEPT WHOLE DISTANCE,,
53,2.5327,6.3162,10.8679,AW,02_06_08_09_14_17_18_,all waves in the cold GRASS,,5
,,,,,,LAZY COW LAY COOL GRASS,,
54,2.3449,4.0637,8.2474,AW,03_04_05_09_11_14_16_,i FROWN when things TAKE a BAD TURN,,5
,,,,,,FROWN EVENTS TAKE BAD TURN,,
55,2.4287,3.0407,9.0245,TA,03_04_09_10_11_13_19_,SLIDE the BOX INTO that EMPTY SPACE ,,5
,,,,,,SLIDE BOX INTO EMPTY SPACE,,
56,2.2007,2.6652,7.193,TA,01_07_10_13_15_16_18_,the JUNKYARD HAD a MOLDY SMELL,,5
,,,,,,JUNK YARD HAD MOLDY SMELL,,
57,1.7234,2.3909,6.1106,AW,02_05_11_15_16_17_18_,TEN kids were sat IN ORDER ,,5
,,,,,,TEN PINS SET IN ORDER,,
58,2.0435,2.7754,6.8632,AW,01_05_06_07_08_13_17_,HELP the arm that feeds you,,5
,,,,,,HELP WOMAN GET BACK FEET,,
59,3.0834,3.4558,8.6066,AW,03_07_08_13_14_17_18_,the NAVY ATTACKED the BIG TASK FORCE,,5
,,,,,,NAVY ATTACKED BIG TASK FORCE,,
60,2.4818,4.073,7.6326,TA,01_03_04_08_09_11_20_,prefer to start when you move ,,5
,,,,,,FUR CATS GOES MANY NAMES,,
61,2.7775,5.7066,10.4103,TA,03_04_08_13_16_18_20_,was BRIGHT browns,,5
,,,,,,NOZZLE FIRE HOSE BRIGHT BRASS,,
62,2.5962,3.132,8.9799,AW,03_04_07_10_12_14_20_,the FROSTY AIR PASSED THROUGH the COAT ,,5
,,,,,,FROSTY AIR PASSED THROUGH COAT,,
63,2.4369,3.8153,8.4549,AW,05_06_11_12_13_17_20_,i mistook it for what she said,,5
,,,,,,OAK STRONG ALSO GIVES SHADE,,
64,2.3743,3.7086,8.9642,AW,01_04_05_08_10_15_18_,the child was WIDE?,,5
,,,,,,HAT BRIM WIDE TOO DROOPY,,
65,2.3234,2.8089,6.9046,AW,05_06_07_10_16_18_20_,he RAN HALFWAY to the HARDWARE STORE,,5
,,,,,,RAN HALF WAY HARDWARE STORE,,
66,2.3725,3.2545,9.1181,AW,03_06_08_11_13_14_19_,he saw that WHILE PLAYING in the SAND ,,5
,,,,,,TWO MET WHILE PLAYING SAND,,
67,2.0889,2.9147,7.2582,TA,01_08_09_11_13_17_19_,the child was 10 YEARS OLD,,5
,,,,,,PURPLE TIE TEN YEARS OLD,,
68,2.138,3.243,9.6906,TA,02_03_08_10_12_15_20_,the ribs HAD an X that MEANT NOTHING ,,4
,,,,,,MAP HAD MEANT NOTHING,,
69,2.8811,3.9904,6.3021,AW,03_08_12_13_15_18_20_,in a rusted TRAP,,5
,,,,,,CAUGHT HIND PAW RUSTY TRAP,,
70,2.4287,2.9306,8.3223,TA,01_10_11_13_14_17_19_,the light SWITCH CANNOT be TURNED OFF ,,5
,,,,,,LAST SWITCH CANNOT TURNED OFF,,
71,2.413,4.0924,4.8121,AW,01_04_13_16_17_18_19_,nope ,,5
,,,,,,WHARF COULD SEEN FARTHER SHORE,,
72,2.3194,2.779,8.187,TA,01_02_04_09_12_14_19_,he WROTE DOWN a LONG LIST of ITEMS ,,5
,,,,,,WROTE DOWN LONG LIST ITEMS,,
73,2.5541,3.0533,7.701,TA,01_08_11_13_14_15_16_,keep it quite GENTLY in black FORM,,5
,,,,,,SHAPE CLAY GENTLY BLOCK FORM,,
74,2.8523,4.7418,8.5414,AW,03_04_06_07_13_15_18_,the INK just DRIED on the first PAGE ,,5
,,,,,,INK STAIN DRIED FINISHED PAGE,,
75,2.1625,2.5781,7.7539,TA,03_06_07_09_11_17_20_,the KITTENs CHASED the DOG DOWN the STREET ,,5
,,,,,,KITTEN CHASED DOG DOWN STREET,,
76,2.3219,3.8208,7.5646,TA,02_04_07_08_10_13_17_,cut the RECORDS in the CASE ,,5
,,,,,,PACK RECORDS NEAT THIN CASE,,
77,2.4273,2.8113,8.1546,TA,03_06_07_09_10_12_20_,the private man as SOON as he SAT DOWN ,,5
,,,,,,PLAY BEGAN SOON SAT DOWN,,
78,2.4902,2.9673,8.3191,TA,03_05_06_12_13_14_18_,to REACH the END you need MUCH COURAGE ,,5
,,,,,,REACH END NEEDS MUCH COURAGE,,
79,2.5199,3.267,7.8747,TA,01_03_05_11_13_18_19_,6 STONES shone that struck me ,,5
,,,,,,FAKE STONES SHINE COST LITTLE,,
80,3.3284,4.4339,9.0576,TA,01_05_06_07_10_16_18_,not a fan of down and SOMETIMES up,,5
,,,,,,MEN THINK PLAN SOMETIMES ACT,,
